Termo,Título,Resumo,Palavras-chave,URL artigo
educação na pandemia,Educação Permanente Digital e Instituições de Ensino Superior: potenciais e desafios multiculturais em período de pandemia,"O artigo objetiva discutir a aprendizagem digital para a Educação ao longo da vida em nível universitário no Brasil, tomado como estudo de caso. Apresenta conceitos de aprendizagem digital em abordagens multiculturais dentro de paradigmas ao longo da vida. Em seguida, contextualiza políticas educacionais na área, focalizando, particularmente, o papel da Universidade Aberta no Brasil. Por fim, discute a aprendizagem digital no contexto do início da pandemia da COVID-19 no Brasil. Analisa desafios que podem comprometer um potencial multicultural nas políticas educacionais, principalmente, com foco nas diretrizes políticas do governo, discutindo respostas de associações universitárias e de uma universidade pública. Conclui, apresentando possíveis caminhos para reflexões e contribuições futuras na área.",Aprendizagem Digital; Aprendizagem ao Longo da Vida; Ensino Superior; COVID-19; Perspectivas Multiculturais; Políticas Educacionais; Brasil,https://www.scielo.br/j/ensaio/a/Vg6JjVrybF59WxL3sRwgzhq/?lang=en
educação na pandemia,Análise da produção científica sobre os serviços farmacêuticos comunitários no enfrentamento da pandemia pelo coronavírus,"Esta revisão buscou sintetizar as práticas em serviços farmacêuticos relacionadas ao gerenciamento e às atividades clínicas em distintos contextos para a prevenção e a assistência durante a epidemia da Covid-19. Trata-se de uma revisão da literatura sobre políticas públicas de saúde para a reorganização da assistência farmacêutica em países atingidos pela Covid-19 realizada nas bases de dados Web of Science, Science Direct e Biblioteca Virtual em Saúde. Foram selecionados 9 artigos, sendo todos publicados em 2020. Destes, 90% foram publicados pelo periódico ‘Research in Social an Administrative Pharmacy’ e tiveram como local de realização de estudo países de três continentes. Foram relatadas e debatidas experiências sobre a atuação do profissional farmacêutico e o papel da farmácia comunitária no contexto da pandemia da Covid-19, e sobre a reorganização destes serviços, evidenciadas no contexto de crise, tanto no que tange à oferta de serviços quanto ao próprio espraiamento da doença. O modelo adotado pelos países para o enfrentamento da Covid-19, no âmbito dos serviços farmacêuticos comunitários, baseou-se em atividades para a garantia da qualidade e logística de insumos e medicamentos, triagem e monitoramento de pacientes, acompanhamento farmacoterapêutico, educação em saúde e informações sobre o uso de medicamentos.",Assistência farmacêutica; Serviços comunitários de farmácia; Infecções por coronavírus; Acesso universal aos serviços de saúde,https://www.scielo.br/j/sdeb/a/FPGtbrv43dmXs4yPb8W5J4g/?lang=pt
educação na pandemia,Gestão da força de trabalho em saúde e COVID-19: desinformação e ausência de Políticas Públicas no Brasil,"Objetivou-se evidenciar as estratégias implementadas no Brasil quanto à força de trabalho em saúde no contexto da pandemia da COVID-19 e analisar as intervenções do Governo Federal na gestão da crise e suas consequências aos profissionais de saúde. Trata-se de pesquisa de abordagem qualitativa do tipo documental. Foram identificadas normativas federais brasileiras alusivas ao trabalho e educação na saúde produzida durante a emergência pandêmica da COVID-19, publicadas no período de 28 de janeiro a 2 de junho de 2020. Do total de 845 documentos encontrados, 62 foram selecionados segundo os critérios de inclusão, os quais foram submetidos à Análise de Conteúdo Temática. Os resultados e discussões foram agrupados em quatro categorias: gestão da força de trabalho, proteção da força de trabalho, capacitação da força de trabalho e relação academia-força de trabalho. Observou-se a ausência de uma política federal coordenadora de ações orientadas à governança da força de trabalho em saúde para o enfrentamento da pandemia no Brasil. Esta lacuna colaborou decisivamente para a trágica situação epidemiológica ainda em curso, sobretudo em termos da exposição de trabalhadores de saúde ao risco de contaminação, revelada nos altíssimos índices de profissionais infectados ou mortos por COVID-19 no Brasil.",Força de trabalho; Profissionais da saúde; COVID-19; Pandemias; Políticas públicas,https://www.scielo.br/j/csc/a/NRLKdxfSJt9qmVXjGdJFXQj/?lang=en
inclusão digital,"ATIVIDADE FÍSICA PARA SAÚDE, COVID-19 E MÍDIAS SOCIAIS: O QUÊ, ONDE E POR QUÊ?","Este estudo concentra-se no uso de mídias sociais por professores de Educação Física (EF) para o ensino de atividade física para saúde durante a pandemia de covid-19. Com base na pesquisa apreciativa e utilizando uma metodologia de teoria fundamentada em dados (Grounded Theory), a análise de duas entrevistas e uma tarefa digital permitem apresentar três principais temas: (1) Mídias Sociais como Ferramenta de Ensino; (2) Um Legado Digital Duradouro?, e; (3) Desigualdade do Aprendizado Remoto. Esses temas destacam a urgência em utilizar mídias sociais quando os espaços físicos da EF foram removidos, o reconhecimento de que o ensino poderia ser diferente no futuro e os desafios inerentes aos espaços digitais. Em conclusão: (1) defendemos a efetiva formação inicial e continuada de professores e no uso positivo de tecnologias digitais; (2) sugerimos que atividades on-line futuras incorporadas ao aprendizado, e; (3) exigir aos governos ações para nivelar as desigualdades tecnológicas. ",Educação Física; Saúde; Inclusão Digital; Tecnologia Digital,https://www.scielo.br/j/mov/a/djwsMRCPTM8f3BxBxXz6mcJ/?lang=pt
inclusão digital,Mudando o ritmo das aulas de alemão como língua adicional por meio de músicas e mídias digitais,"O presente artigo tem o objetivo de discutir e descrever estratégias didáticas durante a realização de um projeto de música em uma disciplina de língua alemã como língua adicional (LA) em contexto universitário. Tendo em vista a importância da inclusão de Tecnologias de Informação e Comunicação (TICs) no ensino de LAs, bem como da promoção do pensamento crítico-reflexivo, focado nos interesses e necessidades da(o)s aluna(o)s de Letras, o projeto de música foi realizado na plataforma Kahoot. Concluímos que as atividades contribuíram para o processo de ensino e aprendizagem em língua alemã, assim como para uma participação mais ativa e crítica por parte da(o)s estudantes.",alemão como língua adicional; música no ensino de línguas adicionais; ensino com mídias digitais,https://www.scielo.br/j/pg/a/hX5BZtSGRDQZ8v8Wt4t4wbg/?lang=pt
inclusão digital,Eu quero entrar na rede: análise de uma experiência de inclusão digital com usuários do Caps,"As transformações ocorridas mundialmente, nos padrões de interrelações sociais pela ampliação do acesso à internet, colocam a inclusão digital como uma estratégia potente no processo de desinstitucionalização do sujeito em sofrimento psíquico. O objetivo deste artigo foi apresentar e analisar uma experiência de inclusão digital que envolveu dez usuários do Centro de Atenção Psicossocial Carlos Augusto da Silva Magal, em Manguinhos, na cidade do Rio de Janeiro. As atividades desenvolvidas foram fruto de decisões tomadas coletivamente a partir da troca de experiência e opiniões entre todos os participantes. Os usuários foram protagonistas na construção do blog Libertando a Mente que se transformou em um ambiente de articulação e espaço de fala para esses usuários, favorecendo a desconstrução de preconceitos. Essa experiência de inclusão digital promoveu a interlocução das vivências dos usuários com seus familiares, moradores do território e com a sociedade. A apropriação das Novas Tecnologias de Informação e Comunicação atuou como instrumento facilitador de autonomia e visibilidade dos usuários envolvidos no projeto. Desse modo, pode ser considerada uma importante ferramenta a ser incorporada no cuidado pautado pela desinstitucionalização, diretriz estruturante da Reforma Psiquiátrica Brasileira.",Internet; Inclusão digital; Saúde mental; Serviços de saúde mental; Pesquisa participativa baseada na comunidade,https://www.scielo.br/j/sdeb/a/N6kBMkqhqckvLxwWDWydHPj/?lang=pt
inclusão digital,Palmas para o E-Dinheiro! A Evolução Digital de uma Moeda Social Local,"Este caso de ensino aborda a digitalização da moeda social local Palmas, emitida desde o início dos anos 2000 em papel-moeda pelo Banco Palmas, para um novo modelo híbrido de mobile payments e mobile money, denominado E-Dinheiro. Trata-se de um empreendimento de desenvolvimento social e de inclusão financeira com amplo reconhecimento nacional e internacional. Ao contar a história do banco comunitário e algumas de suas iniciativas, pretende-se demonstrar o processo de inovação em uma fintech social, abordando questões de governança, gestão de plataformas, aspectos tecnológicos, modelos e estratégia de negócio. Entretanto, com a propagação do seu modelo de negócio para outros bancos comunitários, novos desafios se colocam para o crescimento e a perenidade do empreendimento.",moeda social; banco comunitário; pagamentos móveis; inclusão financeira; tecnologia de informação,https://www.scielo.br/j/rac/a/n3TkXYtmk8kqRBXvrdxSp9c/?lang=pt
inclusão digital,Infodemia de covid-19 em idosos com acesso a mídias digitais: fatores associados a alterações psicopatológicas,"Analisar o perfil sociodemográfico e repercussões da infodemia de covid-19 nas alterações psicopatológicas em idosos com acesso a mídias digitais. Estudo transversal por web-based survey na população acima de 60 anos que utiliza mídias digitais. A análise descritiva contemplou variáveis sociodemográficas e relacionadas à exposição a informações sobre covid-19; analisou-se um conjunto de sinais e sintomas de alterações psicopatológicas devido a essa exposição. Os dados foram analisados pelos testes Mann-Whitney, Kruskal-Wallis e coeficiente de correlação de Spearman. ",Idoso; Covid-19; Internet e Acesso à Informação; Redes Sociais; Pandemia por Covid-19,https://www.scielo.br/j/rbgg/a/jWz4BxhVw5jkpXzSd6pwkVs/?lang=pt#
inclusão digital,Mudando o ritmo das aulas de alemão como língua adicional por meio de músicas e mídias digitais,"O presente artigo tem o objetivo de discutir e descrever estratégias didáticas durante a realização de um projeto de música em uma disciplina de língua alemã como língua adicional (LA) em contexto universitário. Tendo em vista a importância da inclusão de Tecnologias de Informação e Comunicação (TICs) no ensino de LAs, bem como da promoção do pensamento crítico-reflexivo, focado nos interesses e necessidades da(o)s aluna(o)s de Letras, o projeto de música foi realizado na plataforma Kahoot. Concluímos que as atividades contribuíram para o processo de ensino e aprendizagem em língua alemã, assim como para uma participação mais ativa e crítica por parte da(o)s estudantes.",alemão como língua adicional; música no ensino de línguas adicionais; ensino com mídias digitais,https://www.scielo.br/j/pg/a/hX5BZtSGRDQZ8v8Wt4t4wbg/?lang=ptt
inclusão digital,Eu quero entrar na rede: análise de uma experiência de inclusão digital com usuários do Caps,"As transformações ocorridas mundialmente, nos padrões de interrelações sociais pela ampliação do acesso à internet, colocam a inclusão digital como uma estratégia potente no processo de desinstitucionalização do sujeito em sofrimento psíquico. O objetivo deste artigo foi apresentar e analisar uma experiência de inclusão digital que envolveu dez usuários do Centro de Atenção Psicossocial Carlos Augusto da Silva Magal, em Manguinhos, na cidade do Rio de Janeiro. As atividades desenvolvidas foram fruto de decisões tomadas coletivamente a partir da troca de experiência e opiniões entre todos os participantes. Os usuários foram protagonistas na construção do blog Libertando a Mente que se transformou em um ambiente de articulação e espaço de fala para esses usuários, favorecendo a desconstrução de preconceitos. Essa experiência de inclusão digital promoveu a interlocução das vivências dos usuários com seus familiares, moradores do território e com a sociedade. A apropriação das Novas Tecnologias de Informação e Comunicação atuou como instrumento facilitador de autonomia e visibilidade dos usuários envolvidos no projeto. Desse modo, pode ser considerada uma importante ferramenta a ser incorporada no cuidado pautado pela desinstitucionalização, diretriz estruturante da Reforma Psiquiátrica Brasileira.",Internet; Inclusão digital; Saúde mental; Serviços de saúde mental; Pesquisa participativa baseada na comunidade,https://www.scielo.br/j/sdeb/a/N6kBMkqhqckvLxwWDWydHPj/?lang=pt
inclusão digital,Desafios das Fake News com Idosos durante Infodemia sobre Covid-19: Experiência de Estudantes de Medicina,"A pandemia do novo coronavírus trouxe consigo uma infodemia, ou seja, um excesso de informações, que, em populações com baixa análise crítica e falta de conhecimento técnico-científico, pode gerar e disseminar fake news. No Brasil, esses déficits são encontrados frequentemente nos idosos, que representam 13% da população, e na maior parte dos analfabetos absolutos e funcionais, o que os torna tanto vítimas quanto propagadores. Foi realizada uma atividade multicêntrica baseada no projeto-piloto da Faculdade Evangélica Mackenzie do Paraná que promoveu educação em saúde para a população idosa por meio de redes sociais e comunicação on-line. Assim, os estudantes de Medicina ficaram disponíveis para esclarecer dúvidas e mitos relacionados à Covid-19 e enviar materiais informativos. Doze instituições de ensino superior da Região Sul do Brasil replicaram o projeto de 4 de julho a 6 de agosto de 2020, com o objetivo de combater às fake news e estimular a criação de canais de comunicação confiáveis com essa população. A inclusão digital do idoso é algo recente, e a proporção daqueles que são usuários da internet vem crescendo no país. Entretanto, ainda há baixa interpretação crítica de informações, dificuldade de acompanhar o fluxo de notícias e pouca habilidade com ferramentas da internet. Nesse sentido, dar protagonismo a essa população digitalmente invisibilizada e permitir a ampliação do conhecimento médico geriátrico durante a pandemia, por meio do contato de acadêmicos com as demandas dos idosos, é uma forma efetiva de possibilitar um entendimento maior acerca das vulnerabilidades e necessidades do público geriátrico no que tange à educação em saúde. ",Inclusão Digital; Geriatria; Acesso à Informação; Populações Vulneráveis; Coronavírus,https://www.scielo.br/j/rbem/a/SsxfTkKXqDFKnvgWTSCTZtN/?lang=pt
inclusão digital,Inserção digital e desigualdades na demanda por cultura no Brasil,"Este artigo analisa a evolução da concentração dos gastos culturais nas Regiões Metropolitanas (RMs) brasileiras, com base nas Pesquisas de Orçamentos Familiares dos períodos 2002-2003 e 2008-2009. Pretende-se entender as alterações nas práticas de consumo na primeira década dos anos 2000 diante das mudanças tecnológicas recentes, com enfoque na evolução da desigualdade entre e dentro das RMs brasileiras. Para tanto, apresenta-se uma análise dos itens relacionados com o aumento (redução) da concentração dos gastos dentro do domicílio com cultura, através da decomposição do coeﬁciente de Gini segundo os diferentes itens de despesas culturais. Os principais resultados foram: aumento signiﬁcativo no consumo de novas tecnologias de comunicação; aumento da concentração dos gastos fora do domicílio; intensidade da concentração semelhante entre as RMs, enquanto dentro das RMs a renda e a educação são os principais fatores que inﬂuenciam a propensão a consumir.",inclusão digital; gastos com cultura; desconcentração; classes de renda; gastos domiciliares; Regiões Metropolitanas,https://www.scielo.br/j/neco/a/CGH35CjVFStZ8bf9mRs7NXf/?lang=pt
inclusão digital,"Inclusão educacional, digital e social de mulheres no interior da Paraíba: uma experiência na UFPB","Este artigo discute questões de acesso à educação superior e inclusão digital de mulheres. Os sujeitos são alunas de três cursos de licenciatura na modalidade a distância ofertados pela Universidade Federal da Paraíba (UFPB) Virtual: Letras, Pedagogia e Ciências Agrárias. A pesquisa foi qualitativa e exploratória, focada em perspectiva de gênero, com abordagens documental e empírica. O método empregado consistiu na análise textual discursiva de material composto de vários tipos de narrativas. No marco teórico, utilizaram-se obras de Cecília Castaño, Fúlvia Rosemberg, Rena M. Palloff e Keith Pratt, entre outras. As narrativas coletadas e analisadas indicam que algumas mulheres têm, simultaneamente, acesso ao ensino superior e às tecnologias de informação e comunicação (TIC), por meio da educação a distância (EaD), o que propicia a recriação de suas identidades e seu empoderamento. A EaD pode ser, então, uma porta de inclusão, contribuindo para a diminuição da brecha digital de gênero. ",educação superior; educação à distância; gênero; inclusão,https://www.scielo.br/j/rbeped/a/8fKQNpb3htkp7MvMgSkyjwn/?lang=pt
inclusão digital,Programa Um Computador por Aluno: o acesso às tecnologias digitais como estratégia para a redução das desigualdades sociais,"O presente artigo se origina de pesquisa que abordou o Programa Um Computador por Aluno (Prouca), compreendido como política pública para a inclusão digital via ambiente escolar que está alinhada a diretrizes econômicas internacionais de ordem neoliberal. Com base em documentos e entrevistas com 55 profissionais das nove escolas goianas contempladas com o Programa, observamos que o Prouca renova a utopia técnica de que a sociedade evolui qualitativamente com a aquisição de tecnologias de informação e de comunicação. Queremos demonstrar que os identificados problemas e deficiências na infraestrutura para a sua implantação, na gestão de seus processos e na formação dos professores não se constituem em aspectos pontuais, mas estruturantes deste Programa. Por esta razão, o seu mero reajuste ou adequação não são suficientes para equalizar as desigualdades sociais, conforme o propalado.",Tecnologias e educação; Políticas públicas; Prouca; Inclusão excludente,https://www.scielo.br/j/ensaio/a/KpS3ZFqNdcPk6xSP3gczWMk/?lang=pt
inclusão digital,Percepção de conselheiros de saúde sobre acesso às informações e inclusão digital,"Este estudo se insere no contexto da inclusão digital de conselheiros de saúde e fortalecimento de suas práticas. O objetivo foi conhecer a percepção dos conselheiros municipais de saúde em relação ao acesso à informação de saúde e inclusão digital de um município de porte médio do interior paulista. Trata-se de pesquisa qualitativa, alicerçada no método de estudo de caso, realizada com 16 conselheiros titulares de saúde. Foi realizada entrevista orientada por roteiro semiestruturado e os dados foram analisados à luz da análise de conteúdo representacional temática. A discussão foi alicerçada nos referenciais da Teoria da Democracia Participativa e os princípios do Sistema Único de Saúde, com destaque para a diretriz da Participação Comunitária. Evidenciou-se uma insuficiência da educação permanente para conselheiros tanto na área do controle social quanto em inclusão digital. Ainda é incipiente o acesso às informações no campo da saúde por meio digital, tendo como desdobramento a fragilização democrática e participativa do Conselho. Pode haver algum controle daqueles que detém melhor conhecimento sobre as informações relativas à política de saúde. Os conselheiros reconhecem a importância da inclusão digital e desejam participar dela. Conclui-se que há lacunas no acesso às informações de saúde e uma frágil inserção digital, o que pode comprometer o reconhecimento e a efetividade da participação comunitária nas deliberações em saúde pública.",Tecnologia da Informação; Conselhos de Saúde; Participação Social; Informação; Internet; Inclusão Digital,https://www.scielo.br/j/sausoc/a/ZtRsdjZffM5bdYspSZYy9pw/?lang=pt
inclusão digital,Inclusão excludente e utopia digital: a formação docente no Programa Um Computador por Aluno,"Este artigo discute as questões que emergiram em uma pesquisa sobre a formação de professores para a inclusão digital via ambiente escolar no contexto do Programa Um Computador por Aluno no estado de Goiás. Estas questões são abordadas através da convergência de dois eixos temáticos: 1) a formação de professores e a 2) inclusão digital via ambiente escolar, com base em princípios do materialismo histórico-dialético. A contradição e a alienação são utilizadas para colocar em questão o conceito de inclusão digital e para demonstrar que o modelo formativo docente teve como pressupostos básicos a fragmentação e a hierarquização, baseando-se em uma racionalidade instrumental. ",materialismo histórico-dialético; formação de professores; inclusão digital via ambiente escolar; laptops educacionais; tecnologia e educação,https://www.scielo.br/j/er/a/hYVDGsBGBSRnV5pzhbqFVCG/?lang=pt
inclusão digital,Políticas de tecnologias na educação: o Programa Paraná Digital,"O objetivo deste trabalho consiste em analisar a trajetória do Programa Paraná Digital e alguns de seus resultados em escolas públicas estaduais. Para isso, buscou-se, através da metodologia de ciclos de políticas, analisar criticamente a política confrontando, na análise dos três contextos (contexto da influência, contexto da produção do texto e contexto da prática), dados coletados em diferentes fontes: inserção profissional da pesquisadora, literatura já produzida sobre o tema e documentos oficiais sobre os programas desenvolvidos no Paraná, acompanhados de entrevistas com os principais atores. Quanto aos resultados do Programa, é possível afirmar que houve modificação do ambiente das escolas, com a ampliação de recursos úteis ao trabalho do professor; contribuição para a pesquisa e desenvolvimento de softwares e hardwares. Além disso, contribuiu para a iniciação de muitos professores no uso de equipamentos informáticos em suas aulas, embora tais formações tenham priorizado o uso dos equipamentos sem promover debates sobre as tecnologias na educação. O Programa Paraná Digital produziu resultados positivos, mas não consolidou a inclusão digital de alunos e professores do estado do Paraná.",políticas educacionais; Paraná Digital; tecnologias educacionais; ciclos de políticas,https://www.scielo.br/j/er/a/3LRBt8jYyH95Kwk33QgQn6n/?lang=pt
inclusão digital,Socialização e afetividade no processo de inclusão digital: um estudo etnográfico,"Ao considerar as muitas transformações sociais protagonizadas pela evolução tecnológica e a atual produção científica sobre o tema inclusão digital, esta pesquisa apresenta os bastidores do processo de inclusão digital, compreendendo a descrição do processo de aprendizagem sobre as tecnologias de informação e comunicação, a identificação de fatores que implicam no processo e a verificação dos efeitos individuais no processo de inclusão digital de adolescentes, jovens, adultos e idosos, no contexto de três ações de inclusão digital. Os resultados foram explorados a partir de um estudo etnográfico. Como evidências, destaca-se a inclusão digital como ferramenta para a inclusão social e o impacto dos efeitos sociais e afetivos na inclusão digital.",Inclusão digital; Inclusão social; Afetividade; Sociabilidade; TICs,https://www.scielo.br/j/osoc/a/4sz8hyCmRKGJxw4KwCjwByz/?lang=pt
inclusão digital,Desafios do modelo brasileiro de inclusão digital pela escola,"Este artigo discute os rumos da política pública de inclusão digital nas escolas com base nos resultados da pesquisa de avaliação de impacto e de processo do Projeto UCA-Total (Um Computador por Aluno) realizada em cinco municípios onde foi implementado no decorrer de 2010 e 2011. A avaliação de impacto, de caráter longitudinal, foi feita através de um survey domiciliar aplicado em duas ondas. A pesquisa de processo associou diversas metodologias qualitativas, como grupos focais, entrevistas e visitas a campo. Limita-se aqui aos resultados derivados da pesquisa de painel, que revelam o baixo nível de aproveitamento do Projeto e um padrão de funcionamento bastante divergente em razão de vantagens e debilidades locais. Seu enorme potencial não foi até hoje completamente aproveitado.",Inclusão digital; Avaliação do programa; Políticas públicas,https://www.scielo.br/j/cp/a/svTdLfvdMD89B5tKL3YXyzH/?lang=pt
