Termo,Título,Resumo,Palavras-chave,URL artigo
jogos educacionais,Serious games para educação em higiene bucal infantil: uma revisão integrativa e a busca de aplicativos,"O objetivo deste artigo é realizar uma revisão integrativa sobre as publicações que abordam o uso de serious games voltados para educação em higiene bucal infantil e uma busca dos aplicativos disponíveis com esse mesmo fim. Foi conduzida uma revisão integrativa pareada nas bases de dados IBECS, LILACS, SCIENCE DIRECT, SciELO, PUBMED, SCOPUS, MEDLINE e Google Acadêmico, de janeiro a novembro de 2017 e em paralelo uma busca de aplicativos disponíveis na plataforma Android® e em sítios eletrônicos das Ciências da Computação, como o IEEE Xplore. Na revisão integrativa, foram selecionados 12 artigos que atenderam aos critérios de inclusão. Nas buscas em sítios eletrônicos, 11 jogos foram classificados como serious games voltados para higiene bucal. Foram identificados 284 aplicativos na Play Store®, com predomínio para atividades intervencionistas em consultório, sendo dor, cárie dental e trauma os enredos principais. Poucos aplicativos voltados para educação em higiene bucal estão disponíveis. Quanto ao público-alvo, há predomínio do público infantil. Apesar da escassez de publicações sobre o assunto, explorar recursos tecnológicos como meios de educação em higiene bucal infantil sinaliza uma área do conhecimento com potencial acadêmico e com possíveis aplicações para a saúde pública.",Jogos de vídeo; Educação em saúde; Higiene bucal,https://www.scielosp.org/article/csc/2020.v25n8/3299-3310/
jogos educacionais,Classificação da intensidade dos jogos Kinect Sports® em universitários através das variáveis hemodinâmicas e da percepção subjetiva de esforço,"Este estudo analisou a intensidade dos jogos Kinect Sports® em universitários através das variáveis hemodinâmicas e da percepção subjetiva de esforço. Tratou-se de um estudo experimental, com 34 jovens estudantes (21.5±1.9anos) que foram submetidos a três sessões consecutivas de jogos, divididas em jogos de boxe, boliche, beisebol e tênis; vôlei de areia, golfe, atletismo e esqui; tênis de mesa, futebol, dardos e futebol americano. A frequência cardíaca (FC), pressão arterial (PA) e percepção subjetiva de esforço (PSE) foram registradas a cada dois minutos de cada jogo. One-way ANOVA for repeated measurements was used to verify differences in HR, BP and PSE at each time of the game and the effect size (p<0.05). Houve diferenças significativas na FC (p<0.01, η2p<0.284) nos jogos de boxe, atletismo e beisebol; na PAS (p<0.01, η2p<0.203) no atletismo e beisebol, bem como na PSE (p<0.01, η2p<0.309) no boxe, atletismo, esqui, vôlei de areia, tênis, futebol americano e tênis de mesa. Quanto a classificação dos jogos por intensidade, através do percentual de proximidade da Frequência Cardíaca Máxima (FCmáx), apenas o jogo de Boxe se apresentou com intensidade forte (70 a 89% da FCmáx), 50% como intensidade moderada (55 a 69% FCmáx), e 42% dos jogos em intensidade leve (35 a 54% da FCmáx). Conclui-se que uma tabela de classificação que identifique a intensidade dos jogos Kinect Sports® em universitários, possibilita selecionar jogos que estejam voltados a condição física do sujeito, tornando a prática dessa atividade uma alternativa para que o indivíduo passe de um estado de repouso para ativo gerando impactos benéficos a sua saúde.",videogames ativos; exercício físico; educação física; saúde; desempenho,http://www.scielo.pt/scielo.php?script=sci_arttext&pid=S1646-107X2020000200225&lang=pt
jogos educacionais,Jogo e lúdico no conteúdo lutas em aulas de educação física escolar,"O trato pedagógico do conteúdo “lutas” ainda provoca dificuldades e tensões entre professores e alunos. Cabe questionar: quais as relações de sentido, mobilização e atividade dos alunos com os jogos de lutas? O objetivo do presente trabalho é discutir a influência de jogos nas relações de sentido e mobilização no conteúdo lutas na perspectiva dos estudantes. Trata-se de um estudo de caso com uma turma de 7º ano do Ensino Fundamental. Os procedimentos metodológicos foram: (a) observação de aulas do conteúdo “Judô”; (b) entrevistas semiestruturadas com estudantes, antes e após a sequência de aulas. Na observação das aulas, verificou-se que a professora utilizou jogos de lutas, que se mostraram adequadas para minimizar sentimentos de medo, ansiedade e estresse relacionados ao machucar-se na realização da luta. Ademais, a diversão e a ludicidade proporcionada pelos jogos promoveram uma dissociação da luta com a violência e a briga. A imersão e o arrebatamento dos alunos nos jogos de lutas possibilitaram a suspensão de impressões iniciais (luta machuca, é violenta, etc.) estereotipadas em relação às lutas, sobrepujando-os para o mundo de fantasias do jogo. Nesse sentido, os jogos de luta mostram-se essencial para o trabalho pedagógico do conteúdo lutas, sobretudo ao mobilizar a participação de alunos.",Lutas; Jogo; Educação Física escolar,http://www.scielo.org.ar/scielo.php?script=sci_arttext&pid=S2314-25612020000200125&lang=pt
jogos educacionais,Elaboração Conceitual por meio da Criação Colaborativa e Coletiva de Jogos Digitais na Perspectiva da Educação Inclusiva,"Este artigo examina a elaboração de conceitos em crianças com e sem deficiências em atividades de criação de jogos digitais. O estudo apresenta o uso da tecnologia em uma abordagem pedagógica sustentada nas teorias de Vigotski relacionadas à elaboração conceitual, à imaginação e à criatividade na infância e nos estudos em design de jogos com crianças. A pesquisa qualitativa adotou o Design-Based Research (DBR) como abordagem metodológica, que possibilitou a atuação colaborativa e coletiva de estudantes em atividades de criação de jogos. A equipe interdisciplinar foi composta por pesquisadores e acadêmicos das áreas de computação, de educação e de design e de quatro crianças do terceiro ano do Ensino Fundamental de uma escola municipal de Itajaí, Santa Catarina, dentre as quais duas com deficiência intelectual. A análise dos dados revelou a apropriação das crianças sobre conceitos acerca de jogos digitais e seus componentes, a percepção do processo de criação de jogos, a complexidade inerente à construção de tecnologias e o olhar crítico das crianças relativos aos jogos e seu uso. As diferenças intelectuais entre as crianças foram superadas por meio de abordagens que favoreceram suas diferentes competências, o que proporcionou a admiração entre os pares, o respeito mútuo e a inclusão escolar.",Educação Especial; Deficiência intelectual; Criação de tecnologia; Aprendizagem cooperativa,https://www.scielo.br/j/rbee/a/T93Xyy6FGF4CX7TqGLdxSQP/?lang=pt
jogos educacionais,Desenvolvimento da Imaginação e da Criatividade por meio de Design de Games por Crianças na Escola Inclusiva,"Este artigo examina o desenvolvimento da imaginação e da criatividade de crianças com e sem deficiência por meio do design de games. O estudo sustenta-se nas teorias de Vygotski relacionadas à elaboração conceitual, à imaginação e à criatividade na infância e nos estudos avançados em design de jogos com crianças. O Design-Based Research (DBR) foi adotado como abordagem metodológica, configurando pesquisa qualitativa e colaborativa de criação de jogos. Realizaram-se encontros semanais em uma escola da rede de ensino de Itajaí - SC, durante seis meses, os quais envolveram um grupo de quatro crianças de nove anos, dentre as quais duas com deficiência intelectual, pesquisadores e acadêmicos das áreas de computação, design e educação. Buscou-se demonstrar o potencial da abordagem coletiva, criativa e compartilhada de criação de jogos para o desenvolvimento intelectual de crianças em contextos de inclusão escolar. Como resultado definiu-se o framework “Eu fiz meu game” para desenvolvimento de jogos em contextos escolares. As análises dos resultados da pesquisa revelam o empoderamento das crianças envolvidas frente aos desafios propostos, a operação intelectual em níveis complexos, o protagonismo na construção de soluções e a valorização das diferenças individuais, favorecidas pelas atividades coletivas e colaborativas vivenciadas no processo de criação de jogos digitais.",Educação Especial; Jogos; Deficiência intelectual; Criação de tecnologia; Aprendizagem cooperativa,https://www.scielo.br/j/rbee/a/kJbyj3HKnJdSp8QtY9D96tw/?lang=pt
jogos educacionais,"O JOGO E A ""ESCOLA NOVA"" NO CONTEXTO DA SALA DE AULA: MACEIÓ, 1927-1931","O presente artigo tem como objetivo descrever os discursos de intelectuais da educação brasileira, concernente ao jogo na escola, nas décadas de 1920 e 1930. Para tanto, o estudo teve como fonte artigos publicados na Revista de Ensino (1927-1931). O corpo documental foi constituído por 24 edições do periódico, publicado no Brasil, especificamente, em Maceió/AL, no período de 1927 a 1931. Esse recorte temporal evidencia uma época de profunda transformação na educação brasileira, já que se dava início à inclusão das ideias escolanovistas em vários estados do país. Ademais, a análise dos documentos supracitados fundamentou a construção de uma narrativa, que contextualiza as concepções de jogo na escola, segundo o debate escolanovista brasileiro. Ressalta-se que tais concepções vislumbram discursos sobre o jogo como um importante recurso didático e meio de escamotear os conteúdos escolares, mediante um ""ensino lúdico"" centrado na criança.",Jogo; Brincadeira; Escola Nova; Educação ativa; Recurso didático,https://www.scielo.br/j/edur/a/wk54W5VLMbjwTsftHJx5W4D/?lang=pt
jogos educacionais,"Limites e possibilidades de um jogo online para a construção de conhecimento de adolescentes sobre a sexualidade
","O estudo teve como objetivo analisar limites e possibilidades de um jogo online para a construção de conhecimento em saúde dos adolescentes no campo afetivo-sexual e reprodutivo. Trata-se da avaliação da experiência de um grupo de adolescentes com o uso da ferramenta lúdica Papo Reto durante um período de três meses. Participaram do estudo 23 adolescentes, com idade entre 15 e 18 anos. Os dados foram coletados em duas Oficinas de Trabalho realizadas em uma Escola do Ensino Médio de São Paulo (SP). Os diálogos foram gravados, transcritos e analisados por meio de análise de conteúdo. Os resultados revelaram a potencialidade do jogo online Papo Reto para a reconstrução do conhecimento no campo sexual e reprodutivo e para a problematização da realidade a partir da perspectiva de gênero. Os temas abordados no jogo foram avaliados como motivadores para o uso da ferramenta. Foram sugeridos ajustes relativos à necessidade de inclusão de elementos promotores de maior ludicidade e interação para a ferramenta.",Adolescente; Sexualidade; Gênero; Jogos e brinquedos; Educação em saúde,https://www.scielo.br/j/csc/a/RDbQQYzzX7Rq3j4bryjb4YC/?lang=pt
jogos educacionais,"Dispositivos móveis digitais e competências para a utilização na ""sociedade do conhecimento""","O trabalho que se apresenta tem como finalidade identificar os dispositivos móveis digitais aos quais recorrem os alunos universitários espanhóis, assim como analisar as competências que consideram necessárias para a sua utilização na sociedade contemporânea. A parte da investigação aqui abordada enquadra-se no enfoque qualitativo, a partir dos relatos de estudantes que frequentavam a Graduação de Educação Social na Universidade de Vigo. Como conclusões é de destacar o uso quotidiano que os alunos fazem do computador portátil e do telemóvel no âmbito académico, pessoal e social. De forma atenuada utilizam a câmara fotográfica digital, as consolas de jogos, o ebook, o smartphone e o tablet. Consideram que para beneficiarem destes equipamentos e enfrentarem com sucesso os desafios da ""sociedade do conhecimento"" é necessário desenvolverem principalmente a competência de resolução de problemas, de procura de informação, comunicativa, autonomia pessoal e partilha.",sociedade do conhecimento; tecnologias da informação e comunicação; dispositivos móveis digitais; competências; educação superior,http://www.scielo.org.mx/scielo.php?script=sci_arttext&pid=S1405-14352016000100059&lang=pt
jogos educacionais,"Aprendizagem e Jogos: diálogo com alunos do ensino médio-técnico","Este artigo apresenta uma experiência de ensino-aprendizagem por meio de jogos digitais realizada com alunos do ensino médio-técnico de informática. A ideia é aproveitar as habilidades que os alunos possuem com jogos e mostrar como o desenvolvimento de jogos digitais pode auxiliar no ensino de algoritmos e programação de forma lúdica, disciplinas essenciais ao curso de informática, mas que possuem altos índices de reprovação e abandono do curso.",Ensino Médio-Técnico; Jogos Digitais; Algoritmos E Programação,https://www.scielo.br/j/edreal/a/89JDX9dBdtjSnqsnv3TbDkb/?lang=pt
jogos educacionais,Jogo tradicional-popular e aprendizagem: uma análise teórica das comunicações dos jogadores,"Objetiva estabelecer dupla abordagem teórica sobre a comunicação no jogo. Para tal, propomos a praxiologia motriz, com o fim de analisar a lógica interna do jogo, e a pedagogia da corporeidade, com sua analítica existencial do movimento, para compreender o modo de agir dos jogadores. Na especificidade das abordagens, o jogo tradicional-popular recebeu uma análise objetivo-funcional e subjetivo-cultural das ações dos jogadores em sua interação com o ambiente do jogo. Assim, neste ensaio analítico-propositivo, o jogo foi apresentado como situação de movimento privilegiada para os processos de ensino-aprendizagem na escola","jogo; aprendizagem; comunicação; educação física; cultura
",https://www.scielo.br/j/rbeped/a/bwqFYyqFLQrmcQxZ4vVJkmf/?lang=pt
jogos educacionais,"INOVAÇÕES EDUCACIONAIS COM O USO DA REALIDADE AUMENTADA: UMA REVISÃO SISTEMÁTICA","Mediar os processos de ensino e aprendizagem não é tarefa fácil. No contexto educacional, existem muitos casos de sucesso aliando Tecnologias da Informação e Comunicação a esta prática. Uma destas tecnologias, a Realidade Aumentada (RA), pode promover melhorias no compartilhamento de conhecimentos entre alunos e professores. Assim, este artigo objetiva verificar de que forma a RA vem sendo utilizada na educação, por meio de uma revisão sistemática da literatura sobre seu uso neste âmbito. Com base nos resultados, percebe-se que o principal impulsionador para o uso da RA é auxiliar na compreensão dos conteúdos ensinados, bem como na motivação dos estudantes. Como barreira, sobressai a dificuldade no desenvolvimento das atividades utilizando RA, por parte dos professores. O uso de dispositivos móveis, aplicação de RA a livros, uso de jogos com RA e o ensino de Engenharia Civil, Arquitetura, Design e Ciências da Saúde são alguns destaques das descobertas da revisão.",Realidade Aumentada; Inovação Educacional; Tecnologias Educacionais,https://www.scielo.br/j/edur/a/D8BG7VqVDPmYk3d5xmCJJyF/?lang=pt
jogos educacionais,Desenvolvimento e Avaliação da Usabilidade e Acessibilidade de um Protótipo de Jogo Educacional Digital para Pessoas com Deficiência Visual,"Um jogo educacional digital deve ser projetado para que qualquer pessoa possa usá-lo como objeto educacional, sobretudo pessoas com deficiência visual. Entretanto, muitas vezes, não são incluídos e avaliados aspectos de acessibilidade. Objetiva-se, com este artigo, relatar o planejamento e o desenvolvimento de um protótipo de jogo educacional digital para o ensino interdisciplinar de Ciências, Matemática e Educação Científica, bem como a execução da avaliação da acessibilidade com três pessoas com deficiência visual, para garantir um design colaborativo desde os passos iniciais de elaboração do jogo. O protótipo foi desenvolvido de acordo com as etapas de um método de produção de jogos; a execução da avaliação da acessibilidade e da usabilidade foi conduzida por meio de um protocolo adaptado, baseado no Think-Aloud Protocol, com três jogadores com deficiência visual. Os resultados identificaram desafios com os recursos de áudios e as propostas de soluções e, também, com a importância de padronizar as descrições das telas, a proposição de botões para garantir a jogabilidade, e a necessidade de fornecimento de feedback dado pelo jogo após o cumprimento da tarefa. Conclui-se que o design deve ser proposto em parceria colaborativa com diferentes públicos para garantir o desenho universal no desenvolvimento de jogos educacionais inclusivos.",Educação Especial; Jogos Pedagógicos; Educação das Pessoas com Deficiência,https://www.scielo.br/j/rbee/a/mHq5bmhnW9TFTSjV9KWsskx/?lang=pt
jogos educacionais,Um estudo bibliométrico sobre o uso de jogos na área de Engenharia de Produção,"Manter o aluno concentrado durante longos períodos de exposição tem sido um desafio para os docentes. A adoção de novas estratégias de ensino em que os alunos deixam a posição de ouvintes e dividem com o mestre a posição ativa já é conhecida e até mesmo adotada. Essas estratégias dão aos discentes a oportunidade de viverem experiências mais interativas, estimulam o pensamento independente, criam discussões dentro do grupo e contribuem, assim, para a melhoria do processo ensino-aprendizagem. Nesse sentido, a utilização de jogos educacionais tem sido uma alternativa, pois estes podem atenuar a dificuldade que os alunos têm em fazer o paralelo entre os conceitos teóricos aprendidos com situações de aplicação desses conhecimentos. Monitorar o crescimento da literatura e os padrões de pesquisa em determinada área temática é um passo importante para entender o desenvolvimento desse domínio. Assim, a bibliometria tem sido uma área emergente, pois visa descrever, avaliar e monitorar as pesquisas publicadas em determinado campo do conhecimento. Dessa forma, fica definido como objetivo geral deste trabalho mapear e caracterizar as publicações sobre o uso de jogos e termos correlatos na Engenharia de Produção a partir de pesquisa bibliométrica nos anais do Encontro Nacional de Engenharia de Produção. Nesta pesquisa são utilizadas as técnicas Citation, Bibliographic Coupling, Co-author, Co-citation e Co-word, a partir das quais são gerados mapas bibliométricos com o auxílio do software VOSviewer, em que são mostrados, por exemplo, as palavras-chave mais utilizadas; instituições e autores que publicam trabalhos na área; os autores que estão acoplados bibliograficamente; aqueles que trabalham em conjunto; e os que aparecem simultaneamente nas listas de referências.",Jogos; Bibliometria; Ensino-aprendizagem; Engenharia de produção; Vosviewer; Ensino em engenharia,https://www.scielo.br/j/gp/a/GqfbWGLnTL8p6WGFjVvnPyw/?lang=en
jogos educacionais,Desenvolvimento e Avaliação da Usabilidade e Acessibilidade de um Protótipo de Jogo Educacional Digital para Pessoas com Deficiência Visual,"Um jogo educacional digital deve ser projetado para que qualquer pessoa possa usá-lo como objeto educacional, sobretudo pessoas com deficiência visual. Entretanto, muitas vezes, não são incluídos e avaliados aspectos de acessibilidade. Objetiva-se, com este artigo, relatar o planejamento e o desenvolvimento de um protótipo de jogo educacional digital para o ensino interdisciplinar de Ciências, Matemática e Educação Científica, bem como a execução da avaliação da acessibilidade com três pessoas com deficiência visual, para garantir um design colaborativo desde os passos iniciais de elaboração do jogo. O protótipo foi desenvolvido de acordo com as etapas de um método de produção de jogos; a execução da avaliação da acessibilidade e da usabilidade foi conduzida por meio de um protocolo adaptado, baseado no Think-Aloud Protocol, com três jogadores com deficiência visual. Os resultados identificaram desafios com os recursos de áudios e as propostas de soluções e, também, com a importância de padronizar as descrições das telas, a proposição de botões para garantir a jogabilidade, e a necessidade de fornecimento de feedback dado pelo jogo após o cumprimento da tarefa. Conclui-se que o design deve ser proposto em parceria colaborativa com diferentes públicos para garantir o desenho universal no desenvolvimento de jogos educacionais inclusivos.",Educação Especial; Jogos Pedagógicos; Educação das Pessoas com Deficiência,https://www.scielo.br/j/rbee/a/mHq5bmhnW9TFTSjV9KWsskx/?lang=ptt
jogos educacionais,"PROTOCOLO DE AVALIAÇÃO DE SOFTWARES PEDAGÓGICOS: ANALISANDO UM JOGO EDUCACIONAL DIGITAL PARA O ENSINO DE LÍNGUA PORTUGUESA","Como reflexo dos avanços das Tecnologias Digitais de Informação e Comunicação, e visando complementar o ensino, ferramentas digitais interativas, entre as quais podemos citar os jogos pedagógicos digitais, têm estado muito presentes nas escolas brasileiras. Assim, concorrem, hoje, na sala de aula, materiais didáticos impressos e digitais (doravante MDDs). Os MDDs, assim como materiais impressos, precisam passar por uma avaliação rigorosa. Sendo assim, neste trabalho, que foi embasado em Bakhtin/Volochínov (2009); Geraldi (2011); Halliday et al. (1974); e Koch (2002), propomo-nos a responder como se deve avaliar a qualidade de jogos pedagógicos digitais destinados ao ensino de língua materna. Quanto ao principal objetivo da pesquisa, pretendemos, a partir do Protocolo de Avaliação de Softwares Pedagógicos, que desenvolvemos para realizar essa investigação, avaliar a qualidade didáticopedagógica e ergonômica de jogos pedagógicos digitais disponíveis online. Na pesquisa, de caráter descritivo, avaliamos um jogo pedagógico digital destinado ao ensino de Língua Portuguesa. A análise revelou que, embora se tratasse de um jogo educacional digital de qualidade, esse objeto apresentou inadequações tanto quanto aos aspectos didático-pedagógicos quanto aos ergonômicos.",Ensino-aprendizagem de Língua Portuguesa; Jogos educacionais digitais; Protocolo de avaliação,https://www.scielo.br/j/alfa/a/JPrnkHz6rK6BvqZFs93GNZm/?lang=pt
jogos educacionais,"Contribuições das tecnologias educacionais digitais no ensino de habilidades de enfermagem: revisão integrativa","Analisar as contribuições da utilização de tecnologias educacionais digitais no ensino de habilidades de enfermagem. Revisão integrativa da literatura, com busca em cinco bases de dados no período de 2006 a 2015 com combinações dos descritores “educação em enfermagem”, “instrução por computador”, “tecnologia educacional” ou respectivos termos em inglês.Amostra de 30 artigos agrupados nas categorias temáticas “tecnologia na simulação com manequins”, “estímulo à aprendizagem” e “ensino de habilidades de enfermagem”. Identificou-se diferentes formatos de tecnologias educacionais digitais utilizadas no ensino de habilidades de Enfermagem, como vídeos, ambientes virtuais, aplicativos, hipertexto, jogos e simuladores com realidade virtual.Esses materiais digitais colaboraram na aquisição de referencial teórico que subsidiam as práticas, dinamizam o ensino e possibilitam a utilização de métodos ativos de aprendizagem, rompendo com o ensino tradicional de demonstrar e repetir procedimentos.",Educação em enfermagem; Tecnologia educacional; Instrução por computador,https://www.scielo.br/j/rgenf/a/CR4LT8PhNvQkCcs8R9Y9XcH/?lang=pt
jogos educacionais,Jogos ou apps para aprendizagem de línguas: uma investigação utilizando o modelo RETAIN,"A combinação de jogos e dispositivos móveis pode promover oportunidades de aprendizagem ao alcance dos aprendizes e permitir experiências de aprendizagem ubíquas. Uma vez que professores cada vez mais usam jogos para reforçar a aprendizagem de línguas, torna-se essencial avaliar o quão eficiente esses aplicativos são em ajudar os estudantes a aprender o conteúdo e desenvolver as habilidades que eles estão reforçando. Este estudo examina dois apps para a aprendizagem de língua inglesa utilizando o modelo RETAIN. Os resultados apontam que embora esses apps ofereçam algumas oportunidades de aprendizagem de línguas, eles não apresentam cenários ou gameplay entre outros elementos necessários para serem considerados jogos.",Jogos Educacionais Móveis; Aplicativos para Aprendizagem de Línguas; Avaliação de Jogos Educacionais; Modelo RETAIN,https://www.scielo.br/j/rbla/a/ny7pXgbcbYPD8bNtWByRMPg/?lang=en
