Termo,Título,Resumo,Palavras-chave,URL artigo
educação à distância,DOCÊNCIA NA EDUCAÇÃO À DISTÂNCIA: PROCESSOS DE SUBJETIVAÇÃO,"O presente estudo foi produzido para conhecer como os professores universitários vivenciaram a transição da educação superior presencial para a docência no ensino à distância, focalizando a subjetividade docente nas variações decorrentes da nova situação de trabalho. Metodologicamente trata-se de uma pesquisa qualitativa conduzida pela realização de entrevistas semiestruturadas e que adotou como estratégia o estudo de caso visando a caracterização detalhada das mudanças produzidas nos modos de trabalhar. A discussão dos resultados revelou a enorme distância existente entre o ensino presencial e a EAD (Educação à Distância) o que evidenciou a adoção de estratégias de inserção de manutenção nas novas condições laborais. Foram evidenciados os processos de subjetivação dos docentes assim como os procedimentos de controle que passam a incidir sobre o trabalho docente na nova modalidade. Como conclusão provisória destacou-se o desaparecimento da relação presencial e a precarização do trabalho docente.",subjetividade; trabalho docente; mídia,https://www.scielo.br/j/pee/a/wx75hKgC4HHrVtgvkcT5ysN/?lang=pt
educação à distância,ENSINO REMOTO PARA ESTUDANTES DO PÚBLICO-ALVO DA EDUCAÇÃO ESPECIAL NOS INSTITUTOS FEDERAIS,"Em decorrência da pandemia da Covid-19 e das medidas de distanciamento social requeridas, as aulas presenciais foram suspensas no início de 2020. Diante desse novo contexto, o objetivo do estudo consistiu em analisar como ficou o ensino para os estudantes público-alvo da educação especial (PAEE) nos Institutos Federais de Educação, Ciência e Tecnologia (IFs). A abordagem exploratória e descritiva, do tipo pesquisa de levantamento, foi realizada junto a 156 docentes de diferentes campi dos IFs. A coleta de dados foi realizada por meio de questionário. Os dados obtidos foram sistematizados, organizados e analisados quantitativa e qualitativamente em categorias temáticas, acompanhando as variáveis do instrumento. Os resultados evidenciaram que os docentes buscaram diferentes alternativas no ensino remoto, tais como: planejar colaborativamente; adotar procedimentos diferenciados no planejamento específico; prever modificações na prática pedagógica; utilizar material didático e avaliações adaptadas etc. As tecnologias e o ambiente virtual foram considerados tanto em aspectos positivos quanto desafiadores. Conclui-se que a demanda para atender às necessidades educacionais dos estudantes PAEE no ensino remoto exigiu o replanejamento dos processos pedagógicos com diferentes ações que variaram a depender de cada instituto. Contudo, faltaram diretrizes para elaborar o plano de ensino individualizado, assim como maior articulação com os professores de educação especial, o que pode impactar a qualidade do ensino e a aprendizagem do PAEE. Sugere-se que outras pesquisas sejam desenvolvidas, buscando maior aprofundamento e a avaliação das experiências docentes durante o ensino remoto no contexto da pandemia.",inclusão escolar; covid-19; planejamento educacional; acessibilidade curricular; educação profissional,https://www.scielo.br/j/edur/a/HVbpYScg5kWBDg4Q6QsnnKc/?lang=pt
educação à distância,INSTITUCIONALIZAÇÃO DA EDUCAÇÃO A DISTÂNCIA PÚBLICA ENQUANTO FENÔMENO ESSENCIALMENTE DIALÉTICO,"O objetivo deste artigo é examinar as relações de causa e efeito no processo de incorporação orgânica da Educação a Distância (EaD) nas universidades públicas. Para tanto, propomos o conceito de dialética para explicar a institucionalização da modalidade. No que se refere à metodologia, a partir da triangulação metodológica utilizamos diferentes instrumentos, estratégias e fontes de coleta, a saber: análise documental; grupos focais virtuais; entrevistas semiestruturadas; técnica Delphi; e questionário virtual. Os dados foram analisados mediante as abordagens qualitativa e quantitativa, sem perder de vista a nossa matriz epistemológica concernente à sociologia compreensiva de Max Weber. Esta diz respeito à apreensão das universidades enquanto aglomerados de sujeitos que atribuem sentido subjetivo à sua ação socialmente orientada. Com o estudo, chegamos ao entendimento de que a institucionalização da EaD é um fenômeno essencialmente dialético, porque está enredado em constantes embates movidos pelas contradições imanentes. Enquanto persistem as visões dicotômicas, sobretudo por meio do modelo instituído pelo Sistema Universidade Aberta do Brasil (UAB), tem-se importantes percalços na incorporação orgânica da modalidade. Assim sendo, consideramos que a superação dessa política pública de caráter emergencial tende a culminar no processo maior de síntese, em que EaD e educação presencial se tornam justapostas. Chega-se à educação híbrida, uma vez que os qualificativos “presencial” e “a distância” se tornam secundários, dando-se maior enfoque ao processo educacional.",educação a distância; institucionalização; Sistema UAB; dialética,https://www.scielo.br/j/edur/a/rZrHFb9Dz4SJqTNyc7QfxyK/?lang=pt
educação à distância,O ENSINO REMOTO DE EDUCAÇÃO FÍSICA EM NARRATIVA: ENTRE RUPTURAS E APRENDIZADOS NA EXPERIÊNCIA COM A TECNOLOGIA,"A literatura tem apostado na compreensão coevolutiva entre tecnologia e educação destacando o professor como peça-chave neste processo. O objetivo do texto é problematizar a vivência pedagógica de uma professora de Educação Física da rede estadual de ensino durante a pandemia de covid-19, sob as lentes do neotecnicismo e das literacias emergentes. Adotou-se a metodologia qualitativa a partir dos estudos narrativos, dos casos pedagógicos e suas contribuições para formação docente. Como resultados percebeu-se o sentimento de incompetência para lidar com plataformas digitais, o apoio de uma rede de colaboração por pares, a urgência do “como utilizar ferramentas tecnológicas” e, em segundo plano, “o que ensinar”. Considera-se, por fim, que pensar o ensino remoto de Educação Física na pandemia é mais do que pensar em tecnologia, mas antes é refletir sobre como o professor se forma pela experiência e as possibilidades de modificação na percepção de aula de Educação Física neste contexto. ",Educação Física; Covid-19; Educação a distância; Narrativa Pessoal,https://www.scielo.br/j/mov/a/zwjhPff8QG3cFgQ8xxVQQZD/?lang=pt
educação à distância,APRENDIZAGEM VIRTUAL: UM AUTOESTUDO SOBRE EVOLUÇÕES EM PRÁTICAS PEDAGÓGICAS,"Este artigo relata a primeira fase de um projeto de três anos em que exploramos formas de adaptar e desenvolver nossas práticas pedagógicas em relação ao uso de novas e emergentes tecnologias digitais. Neste artigo, nos concentramos em nossas experiências de ensino remoto de emergência (ERT). Essa experiência aconteceu no meio do semestre, onde tivemos que migrar do ensino presencial, em sala de aula, para o ensino remoto. Através de uma abordagem dialética, possibilitada pelo autoestudo, tivemos a oportunidade de apoiar uns aos outros, descrever os principais desafios que enfrentamos e identificar os principais pressupostos que sustentam nossas práticas como professores em contextos de aprendizagem a distância, ensino digital. Os temas encontrados nessa relação dialética foram nomeados como: a visibilidade dos alunos, as restrições da tecnologia e o fato de voltarmos a ser professores universitários novatos novamente. ",Educação a distância; Educação superior; covid-19; Autoestudo; Alfabetização digital,https://www.scielo.br/j/mov/a/YhQNtPR57hw7SwsdtdKMVRd/?lang=pt
educação à distância,Remando ou guiando o barco? Modelos de governança para as políticas de Educação Superior no Brasil pós-1990,"Este artigo tem como objetivo analisar o papel que os governos no Brasil têm desempenhado na condução de políticas de Educação Superior, tomando como referência uma tipologia que estabelece quatro modos de governança para a este tipo de Educação: o hierárquico, o procedimental, a condução a distância e a autogovernança. Além disso, considera três diferentes fases do Estado avaliador, para analisar o seu grau de autonomia frente aos organismos internacionais. Com base no referencial teórico adotado, conduz-se um estudo de caso do sistema de Educação Superior brasileiro, no período de 1995 a 2017, por meio de pesquisa documental e análise de conteúdo. Os resultados indicam que o modo de governança das políticas de Educação Superior no Brasil é, predominantemente, de condução a distância, com traços do modo hierárquico. Além disso, evidencia-se que o Estado mantém relativa autonomia frente aos organismos internacionais, dando sinais de aproximação com a Organização para a Cooperação e Desenvolvimento Econômico.",Educação Superior; Governança; Avaliação da qualidade,https://www.scielo.br/j/ensaio/a/XzGxBYn8j6tRp67HLjXq35r/?lang=pt
educação à distância,Territórios pouco explorados: o estudo dos registros de visitantes em livros de comentários de dois museus de ciências brasileiros,"Neste trabalho, de caráter qualitativo e exploratório, estudamos os livros de comentários de dois museus e centros de ciências brasileiros - a Casa da Ciência da Universidade Federal do Rio de Janeiro e o Museu Ciência e Vida da Fundação Centro de Ciências e Educação Superior a Distância do Estado do Rio de Janeiro - a fim de compreender e explorar seu potencial para coletar dados sobre a opinião dos públicos. Ao todo coletamos 1.724 comentários de 10 livros, do período de 2011 a 2018. Para exploração e análise, adotamos a análise de conteúdo, bem como um protocolo que divide os comentários em: pré-ativo, ativo e proativo. Nos interessou analisar os comentários apontados como ativos e proativos, totalizando em 1.512 registros, organizados nas seguintes categorias: acessibilidade; afetividade; ciência e aprendizagem; equipe; exposição; infraestrutura; papel dos espaços museológicos na sociedade.A multiplicidade de fatores que puderam ser elencados ao estudarmos os livros de comentários, nos permite afirmar que eles são uma rica fonte de informação a respeito dos públicos que frequentam os museus e suas demandas. Contudo, eles ainda são territórios pouco explorados, tanto nas instituições museais, quanto em áreas acadêmicas, e esses registros não podem ser silenciados e esquecidos.",livros de comentários; museus; estudos de público; divulgação científica,https://www.scielo.br/j/pci/a/rbmxPhGHcPf3CXKtqdKX5xN/?lang=pt
educação à distância,Competência em Informação no contexto EAD: reflexões sobre as práticas profissionais do tutor a distância,"Apresenta resultado de pesquisa, que objetivou analisar a Competência em Informação no contexto da Educação a Distância (EAD), por meio da prática profissional de tutores a distância. Para tanto, como aporte teórico a pesquisa discorre sobre temas relacionados à EAD, Competência em Informação, os sete pilares de Bruce (1999) e sugere um quadro que inter-relaciona as temáticas. Os procedimentos metodológicos adotados referem-se a uma pesquisa de campo em uma instituição de ensino EAD, de uma cidade do interior do Paraná. Os dados qualitativos foram colhidos por meio de entrevista semiestruturada com os tutores a distância, com objetivo de identificar a prática da Competência em Informação em suas atuações profissionais. Os resultados identificaram que embora os tutores apresentem habilidades informacionais, a prática da CoInfo não é institucionalizada na universidade em questão. Conclui-se que a aplicação de modelos de Competência em Informação é essencial para a otimização de práticas profissionais no cenário EAD.",Competência em Informação; Educação a Distância; Tecnologia da Informação; Comunicação,https://www.scielo.br/j/pci/a/8CQVwGrKrgPVS3PdPFcHRxg/?lang=pt
educação à distância,No desligar das câmeras: experiências de estudantes de ensino superior com o ensino remoto no contexto da Covid-19,"Este artigo apresenta os movimentos iniciais de uma pesquisa etnográfica realizada com estudantes de ensino superior sobre suas experiências com o ensino remoto em 2020. Após a suspensão das atividades presenciais na pandemia, professores e estudantes se viram imersos em desafios decorrentes de um afrouxamento dos vínculos que sustentam a relação ensino-aprendizagem. Dessa forma, busca-se compreender como estudantes percebem e significam suas experiências com o ensino remoto, considerando-se as condições materiais para tanto e a rede de atores e agências que passam a determinar essas experiências no espaço doméstico. Assim, este estudo se volta para a dimensão vivencial das tecnologias digitais, considerando-se sua ubiquidade na vida contemporânea. Pretende-se, por fim, contribuir para a concepção de projetos educacionais que transcendam a instrumentalização tecnológica e se alinhem às gramáticas interativas mais significativas das socialidades contemporâneas, marcadas pela pervasividade das tecnologias digitais.",Pandemia; Ensino remoto emergencial; Etnografia; Educação Superior; Joinville,https://www.scielo.br/j/civitas/a/sh4bXpyhyNmPgSH4snCTrKx/?lang=pt
educação à distância,ANÁLISE EMPÍRICA E INVESTIGAÇÃO DE INTERVENÇÃO SOBRE O MECANISMO DE INFLUÊNCIA NA SAÚDE DOS ESTUDANTES UNIVERSITÁRIOS SOB A PERSPECTIVA DO DESPORTO PÚBLICO,"A construção de esportes públicos não só melhora o desempenho esportivo dos estudantes universitários, como também melhora o nível de saúde desses estudantes. Atualmente, as instalações esportivas em faculdades e universidades não são boas, e as razões para impedir a melhoria da saúde física dos estudantes são mais complexas. A fim de explorar os problemas existentes na construção de esportes públicos em faculdades e universidades, este estudo utilizou o método da literatura, o método Delphi, o método de levantamento por questionários e o método de análise de fatores para analisar o mecanismo de impacto na saúde dos estudantes universitários, e realizou pesquisas de intervenção de acordo com os resultados da análise. A análise de fatores foi usada para extrair os fatores dos alunos, fatores escolares, fatores dos pais e fatores sociais dos trinta fatores que influenciam o questionário, e através de análise empírica, resumiu-se o mecanismo de influência da saúde dos alunos, como pressão na aprendizagem, carga curricular de educação física, atenção à saúde familiar e assim por diante. Tendo em conta os principais fatores influenciadores, concebeu-se a intervenção visada, incluindo a melhoria da conscientização dos estudantes e dos pais para o exercício físico e o reforço da carga dos programas de educação física nas faculdades e universidades. Antes e depois da intervenção, o teste de sprint e de longa distância dos estudantes mostra que a aptidão física dos estudantes foi significativamente melhorada, e os resultados da intervenção mostram que a intervenção orientada pode promover o desenvolvimento saudável dos estudantes universitários. Espera-se que este estudo possa reforçar o nível de concepção dos serviços de públicos esportivos em faculdades e universidades, de modo a melhorar a qualidade física dos estudantes.",Estudantes; intervenção na saúde; mecanismo de influência; método de análise de fatores,https://www.scielo.br/j/rbme/a/qDmtn88cxCTGbhHmnQBJswS/?lang=en
educação à distância,"GOOGLE SITES COMO FERRAMENTA DE ENSINO DE EDUCAÇÃO FÍSICA A DISTÂNCIA EM TEMPOS DE COVID-19: PEDAGOGIA, ESTRATÉGIAS, REFLEXÕES E BARREIRAS DE UM PROFESSOR","A covid-19 resultou na implementação de medidas de distanciamento social e fechamento de escolas no mundo. Este estudo explora alguns dos impactos, tais como escolhas pedagógicas, reflexões e barreiras do professor quando ele repentinamente mudou para um ambiente de ensino online e teve que ministrar aulas de Educação Física (EF) com o uso da tecnologia (Google Sites). A metodologia do autoestudo com análise temática foi utilizada para investigar as experiências do autor principal. Achados destacam como o professor teve que encontrar novas formas de ensino online, fazendo com que os alunos não estivessem exclusivamente em frente à tela, e atendesse as características sociais e dinâmicas da EF. Finalmente, as experiências e o processo de reflexão demonstraram a necessidade de ser coerente com as escolhas pedagógicas e abordagens teóricas e práticas como professor. Este artigo contribui para futuras formas de ensino de EF online, ao compreender a práxis de um professor.",Covid-19; Mudança social; Educação Física; Educação a distância; Auto estudo,https://www.scielo.br/j/mov/a/ybB5FqTbx5f5ydhqGzH3pMy/?lang=pt
educação à distância,ENSINO REMOTO PARA ESTUDANTES DO PÚBLICO-ALVO DA EDUCAÇÃO ESPECIAL NOS INSTITUTOS FEDERAIS,"m decorrência da pandemia da Covid-19 e das medidas de distanciamento social requeridas, as aulas presenciais foram suspensas no início de 2020. Diante desse novo contexto, o objetivo do estudo consistiu em analisar como ficou o ensino para os estudantes público-alvo da educação especial (PAEE) nos Institutos Federais de Educação, Ciência e Tecnologia (IFs). A abordagem exploratória e descritiva, do tipo pesquisa de levantamento, foi realizada junto a 156 docentes de diferentes campi dos IFs. A coleta de dados foi realizada por meio de questionário. Os dados obtidos foram sistematizados, organizados e analisados quantitativa e qualitativamente em categorias temáticas, acompanhando as variáveis do instrumento. Os resultados evidenciaram que os docentes buscaram diferentes alternativas no ensino remoto, tais como: planejar colaborativamente; adotar procedimentos diferenciados no planejamento específico; prever modificações na prática pedagógica; utilizar material didático e avaliações adaptadas etc. As tecnologias e o ambiente virtual foram considerados tanto em aspectos positivos quanto desafiadores. Conclui-se que a demanda para atender às necessidades educacionais dos estudantes PAEE no ensino remoto exigiu o replanejamento dos processos pedagógicos com diferentes ações que variaram a depender de cada instituto. Contudo, faltaram diretrizes para elaborar o plano de ensino individualizado, assim como maior articulação com os professores de educação especial, o que pode impactar a qualidade do ensino e a aprendizagem do PAEE. Sugere-se que outras pesquisas sejam desenvolvidas, buscando maior aprofundamento e a avaliação das experiências docentes durante o ensino remoto no contexto da pandemia.",inclusão escolar; covid-19; planejamento educacional; acessibilidade curricular; educação profissional,https://www.scielo.br/j/edur/a/HVbpYScg5kWBDg4Q6QsnnKc/?lang=ptt
educação à distância,"ENXADA, CANETA E MOUSE: O DIÁLOGO ENTRE TECNOLOGIAS NA FORMAÇÃO CONTINUADA DE PROFESSORES DO CAMPO NA MODALIDADE A DISTÂNCIA","A educação do campo é um direito cidadão, assim como a inclusão digital. A concepção teórica escolhida compreende que há diferentes saberes, diversas tecnologias e múltiplas possibilidades de colocá-las como parceiras nos processos de ensino e de aprendizagem. A pesquisa contou com a participação de quinze tutores e dois coordenadores do Curso de Especialização em Educação do Campo/UFMS/EaD. Também participou uma liderança do campo, professor e concluinte da primeira edição do Curso. A pesquisa enfatizou que as tecnologias eletrônico-digitais estão presentes no cotidiano do campo de MS, mas com diferentes níveis de qualidade ao acesso e aos equipamentos, sendo o aspecto mais comprometedor a internet. Mesmo assim, essas tecnologias se constituem como caminhos para a formação continuada, com o cuidado de não negarem os saberes do campo e não se contraporem ao tempo cíclico do plantio, da oralidade, da terra como espaço e expressão da vida em comunidade.",Educação do campo; Inclusão digital; Formação continuada; Ensino a distância,https://www.scielo.br/j/edur/a/PHWpVQZkpgJ3sCzHpRhMzqP/?lang=pt
educação à distância,TECNOLOGIAS E MEDIAÇÃO PEDAGOGICA NA EDUCAÇÃO SUPERIOR A DISTANCIA,"Este estudo investigou as percepções sobre limites e possibilidades do uso pedagógico das tecnologias na educação superior a distancia de docentes que atuam em um curso presencial de ciências contábeis. Realizou-se uma pesquisa descritiva - qualitativa, os dados foram coletados por meio de formulário online com questões “abertas” e analisados por meio da análise de conteúdo. Constatou-se que os benefícios da EaD, na visão dos docentes são “o acesso à educação superior”; a “flexibilização do tempo e do espaço”; a “autodisciplina e a autoaprendizagem do aluno”. Como pontos críticos citaram a “falta de formação para a inclusão digital do grupo de professores e alunos e a “dificuldade para promover a interação”. Como desafio citaram a “superação da ausência da relação direta aluno/professor, o “face-a-face”, típico da sala de aula; o “uso de estratégias e recursos que promovam a troca de experiências e a interação”; o “perfil do aluno”; a ”falta de maturidade” a “autodisciplina”. Conclui-se, assim, que, as mídias digitais são vistas pelos docentes ainda como instrumentos didáticos apenas, fato que dificulta uma leitura mais critica das tecnologias e a exploração de todo o potencial que possuem, principalmente como meio de expressão e de produção cultural.",Educação a distância; Mídias digitais; Formação docente; Educação contábil,https://www.scielo.br/j/jistm/a/5GM3chmQBwDdKcp3snZYFKc/?lang=pt
educação à distância,Educação a distância na formação profissional continuada de professores da educação básica: analisando contratos e destratos didáticos a partir de um estudo de caso,"Os conceitos de contrato e de destrato didáticos foram desenvolvidos por Lacerda Santos e Iunes (2013), em uma investigação sobre aspectos que facilitam a relação entre informática e educação - os chamados contratos didáticos - e sobre aqueles que dificultam o estabelecimento de tal relação - os chamados destratos didáticos. Neste texto, apresentamos uma discussão baseada nos resultados de uma observação participante de uma situação educativa virtual na qual contratos e destratos didáticos foram relacionados com indicadores de inclusão e de fluência digitais de professores da educação básica, condições imprescindíveis para o sucesso de toda e qualquer ação de formação profissional continuada mediada pelas Tecnologias Digitais de Informação, Comunicação e Expressão (TDICE). Trata-se do relato de um estudo de caso em que professores experientes e digitalmente incluídos foram colocados em situação de alunos de um curso de especialização a distância. As conclusões do estudo indicam a existência de um cenário ainda preocupante para a implantação de cursos de formação continuada em serviço, que têm a inclusão e a fluência digitais como prerrequisitos para o funcionamento dos cursos. Ressaltam-se também as dificuldades prementes na promoção da inclusão digital de professores, especialmente daqueles já engajados no mercado de trabalho, no exercício da profissão.",inclusão digital de professores; educação a distância; formação continuada de professores,https://www.scielo.br/j/er/a/HDhHVBhFrkyMLJBwBxVrDGs/?lang=pt
educação na pandemia,"O primeiro Curso Aberto, On-line e Massivo (Mooc) sobre Covid-19 e iniquidades no Brasil: potências da saúde coletiva no enfrentamento da infodemia e das fake news","A pandemia do novo coronavírus emergiu em momento de avanço do neoliberalismo, com o agravamento das desigualdades sociais, os poucos investimentos para a ciência, a expansão do negacionismo científico e a intensa produção de informações falsas (fake news). Os Cursos On-line Abertos e Massivos (Mooc) têm sido utilizados como estratégia para a difusão científica e o enfrentamento da infodemia, pois ampliam o acesso à informação e atingem um maior público. O objetivo do artigo foi apresentar a idealização, a concepção e o desenvolvimento do primeiro Mooc no campo da saúde coletiva sobre a Covid- 19 e iniquidades em saúde. Trata-se de um estudo descritivo sobre a ferramenta de ensino a distância. Durante os 12 meses de oferta, foram registradas 5.721 inscrições e 3.433 cursistas concluintes, com uma taxa de conclusão de 60%. O Mooc atuou de modo exitoso em um front de batalha de desentendimento, da infodemia e do embaralhamento de mentiras. Além disso, consolidou uma avaliação positiva de insti- tuições, que passam por grave crise de confiança. Destaca-se a propriedade de difusão científica massiva e combate às fake news sobre a Covid-19 do primeiro curso Mooc do gênero no País.",Covid-19; Iniquidade em saúde; Educação à distância; E-learning; Saúde pública,https://www.scielo.br/j/sdeb/a/LsD77FqrBzqfGSKqpMWWybK/?lang=pt
educação na pandemia,"Pandemia de covid-19, ensino remoto e a potencialização das desigualdades educacionais",O presente artigo discute a adoção de modalidades de ensino remoto no contexto da pandemia de covid-19 e a potencialização das desigualdades educacionais no Brasil.,pandemia; covid-19; desigualdades educacionais; ensino remoto; educação a distância (EAD,https://www.scielo.br/j/hcsm/a/PsyyZM3qmWPBQcBMm5zjGQh/?lang=pt
